{
  "schema_version": "0.2.0",
  "run_id": "wf_d4b5afdd-aca5-4663-b263-da0520994fe8",
  "raw_id": "raw_82192282f5968b58",
  "suggestion_run_id": "run_64c380d8f6d5f6f8",
  "status": "running",
  "current_stage": "proposal",
  "stages": {
    "intake": {
      "status": "completed",
      "version": 1,
      "artifact_id": "artifact_0b39c3d090f2389d0b5b",
      "sha256": "78e99d298c289bc877da23a48962cadc2a4881205b80a2cf6ca85c10608bfdca",
      "error": null
    },
    "router": {
      "status": "completed",
      "version": 1,
      "artifact_id": "artifact_65802b76e06111fc014c",
      "sha256": "626675b9c8d53af0a1c04e840994ca8c4c8a2721dbc51bfc16590cf5051ee84d",
      "error": null
    },
    "atomicizer": {
      "status": "completed",
      "version": 1,
      "artifact_id": "artifact_003822ee0c11a5672e2f",
      "sha256": "108b9cc9101384fadd86a148caa0fc1a900123aa8009e3c991f53cc044821092",
      "error": null
    },
    "claims": {
      "status": "completed",
      "version": 1,
      "artifact_id": "artifact_aba4df624008d8695c4f",
      "sha256": "e73ce95d3f4459b1e48e0b3e1d4ed09ae298d43ac545acd8a46280b8da21b556",
      "error": null
    },
    "family_builder": {
      "status": "completed",
      "version": 1,
      "artifact_id": "artifact_1682414fbefd942c1551",
      "sha256": "3c974856c06f1aaeae653c7d1ae64199a75302e3c87664e1c6da58f04bc3a9d0",
      "error": null
    },
    "theme_builder": {
      "status": "completed",
      "version": 1,
      "artifact_id": "artifact_52d2fdd46a08a03458b0",
      "sha256": "f799ead86c597c48ab49ebdd30d9fed078e40a383932d0a2326cd2c0352b5bd2",
      "error": null
    },
    "reconciler": {
      "status": "completed",
      "version": 1,
      "artifact_id": "artifact_6c20821c61f11f184fa6",
      "sha256": "81c622134bab783403ac9d60c650323dd8fee83303c0230c12fc5c3d537cb5d3",
      "error": null
    },
    "distiller": {
      "status": "completed",
      "version": 1,
      "artifact_id": "artifact_fdd4c92b00e9c788b87d",
      "sha256": "8a085cd566d8d549b1aaeb687023f15523c1266c7ebee470fc89aebd7f070143",
      "error": null
    },
    "proposal": {
      "status": "not_started",
      "version": 0,
      "artifact_id": null,
      "sha256": null,
      "error": null
    },
    "canonical": {
      "status": "not_started",
      "version": 0,
      "artifact_id": null,
      "sha256": null,
      "error": null
    },
    "skill_candidate": {
      "status": "not_started",
      "version": 0,
      "artifact_id": null,
      "sha256": null,
      "error": null
    },
    "skill_builder": {
      "status": "not_started",
      "version": 0,
      "artifact_id": null,
      "sha256": null,
      "error": null
    },
    "evaluator": {
      "status": "not_started",
      "version": 0,
      "artifact_id": null,
      "sha256": null,
      "error": null
    },
    "skill_publish": {
      "status": "not_started",
      "version": 0,
      "artifact_id": null,
      "sha256": null,
      "error": null
    }
  },
  "checkpoints": {},
  "decisions": [],
  "created_at": "2026-09-15T09:53:53.005Z",
  "updated_at": "2026-09-15T09:53:53.046Z"
}